overall_rank,rank_within_class,gene_accession,gene_description,f_score,favors_class
1,1,Y00787_s_at,INTERLEUKIN-8 PRECURSOR,41.58334475273399,AML
2,2,M27891_at,CST3 Cystatin C (amyloid angiopathy and cerebral hemorrhage),39.11046313885508,AML
3,3,M11147_at,FTL Ferritin; light polypeptide,33.111958662271846,AML
4,4,M69043_at,MAJOR HISTOCOMPATIBILITY COMPLEX ENHANCER-BINDING PROTEIN MAD3,32.69223048802295,AML
5,1,M13792_at,ADA Adenosine deaminase,12.049803097092418,ALL
6,2,L06797_s_at,PROBABLE G PROTEIN-COUPLED RECEPTOR LCR1 HOMOLOG,11.896947937343883,ALL
7,3,HG2887-HT3031_at,Sry-Related Hmg-Box 12 Protein (Gb:X73039),5.604395032725145,ALL
8,4,X00437_s_at,TCRB T-cell receptor; beta cluster,3.155688593581007,ALL
