overall_rank,rank_within_class,gene_accession,gene_description,f_score,favors_class
1,1,M14483_rna1_s_at,PTMA gene extracted from Human prothymosin alpha mRNA,25.88140890843037,ALL
2,1,M11147_at,FTL Ferritin; light polypeptide,23.06885712612597,AML
3,2,M69043_at,MAJOR HISTOCOMPATIBILITY COMPLEX ENHANCER-BINDING PROTEIN MAD3,21.8863419550141,AML
4,3,Y00787_s_at,INTERLEUKIN-8 PRECURSOR,19.01909020141497,AML
5,2,M13792_at,ADA Adenosine deaminase,18.98130217364798,ALL
6,4,L19779_at,Histone H2A.2 mRNA,13.521843093060921,AML
7,3,X00437_s_at,TCRB T-cell receptor; beta cluster,6.773289467079607,ALL
8,4,M12886_at,TCRB T-cell receptor; beta cluster,6.628978710818854,ALL
